{
  "schema_version": "2026-06-24",
  "canonical_root": "microcosting_healthservices",
  "policy_documents": {
    "topology": "conductor/repository-topology.md",
    "outer_wrapper": "conductor/outer-wrapper-retirement.md",
    "release_boundary": "conductor/release-boundary-control-plane.md",
    "artifact_retention": "conductor/generated-artifact-retention-policy.md",
    "worktree_hygiene": "conductor/worktree-branch-pr-hygiene.md",
    "future_split": "conductor/future-repo-split-playbook.md"
  },
  "surfaces": [
    {
      "id": "python-runtime",
      "display_name": "Python runtime package",
      "category": "package",
      "lifecycle": "implemented",
      "support_status": "ga",
      "path": ".",
      "manifests": [
        "pyproject.toml"
      ],
      "owner_track": "python_pypi_registry_submission_20260524",
      "ci_gate": ".github/workflows/pr-ci.yml#quality-tests-coverage",
      "release": {
        "target": "PyPI",
        "workflow": ".github/workflows/release.yml",
        "version_source": "setuptools_scm plus nwau_py/_version.py",
        "registry_state": "published_verified",
        "evidence": [
          "README.md#package-registry-status",
          "conductor/tracks/python_pypi_registry_submission_20260524/"
        ],
        "external_gate": null
      },
      "artifact_policy": "source",
      "formula_logic": "shared-core",
      "claim_boundary": "Python remains the current validated runtime while Rust promotion is stream-gated."
    },
    {
      "id": "rust-workspace",
      "display_name": "Rust workspace and core crates",
      "category": "workspace",
      "lifecycle": "implemented",
      "support_status": "canary",
      "path": "rust",
      "manifests": [
        "rust/Cargo.toml",
        "rust/crates/nwau-c-abi/Cargo.toml",
        "rust/crates/nwau-core/Cargo.toml",
        "rust/crates/nwau-py/Cargo.toml",
        "rust/crates/nwau-py/pyproject.toml"
      ],
      "owner_track": "rust_core_continuation_20260524",
      "ci_gate": ".github/workflows/pr-ci.yml#rust",
      "release": {
        "target": "crates.io and GitHub Releases",
        "workflow": ".github/workflows/release.yml",
        "version_source": "rust/Cargo.toml",
        "registry_state": "published_verified",
        "evidence": [
          "README.md#package-registry-status",
          "docs/release-evidence-rust-continuation.md"
        ],
        "external_gate": null
      },
      "artifact_policy": "source",
      "formula_logic": "shared-core",
      "claim_boundary": "Rust support is limited to stream-specific parity evidence and must not be claimed GA across calculators."
    },
    {
      "id": "docs-site",
      "display_name": "Starlight documentation site",
      "category": "docs",
      "lifecycle": "implemented",
      "support_status": "preview",
      "path": "docs-site",
      "manifests": [
        "docs-site/package.json"
      ],
      "owner_track": "docs_sota_starlight_completion_20260513",
      "ci_gate": ".github/workflows/docs-site.yml",
      "release": {
        "target": "GitHub Pages",
        "workflow": ".github/workflows/docs-site.yml",
        "version_source": "docs-site/package.json",
        "registry_state": "published_verified",
        "evidence": [
          "README.md#documentation",
          "docs-site/src/content/docs/"
        ],
        "external_gate": null
      },
      "artifact_policy": "source",
      "formula_logic": "not-applicable",
      "claim_boundary": "Docs describe support truthfully and must not expand calculator validation claims."
    },
    {
      "id": "r-binding",
      "display_name": "R binding package",
      "category": "binding",
      "lifecycle": "implemented",
      "support_status": "preview",
      "path": "r-binding",
      "manifests": [
        "r-binding/DESCRIPTION"
      ],
      "owner_track": "r_binding_20260512",
      "ci_gate": "tests/test_r_binding_track.py",
      "release": {
        "target": "CRAN",
        "workflow": "manual CRAN submission",
        "version_source": "r-binding/DESCRIPTION",
        "registry_state": "submitted",
        "evidence": [
          "conductor/tracks/r_cran_registry_submission_20260524/"
        ],
        "external_gate": "CRAN maintainer review and publication proof"
      },
      "artifact_policy": "source",
      "formula_logic": "adapter-only",
      "claim_boundary": "R package readiness is local until CRAN publication is publicly verified."
    },
    {
      "id": "julia-binding",
      "display_name": "Julia binding package",
      "category": "binding",
      "lifecycle": "implemented",
      "support_status": "preview",
      "path": "julia-binding",
      "manifests": [
        "julia-binding/Project.toml"
      ],
      "owner_track": "julia_binding_20260512",
      "ci_gate": "tests/test_julia_binding_track.py",
      "release": {
        "target": "Julia General registry",
        "workflow": "manual JuliaRegistrator and General PR",
        "version_source": "julia-binding/Project.toml",
        "registry_state": "published_verified",
        "evidence": [
          "conductor/archive/julia_general_registry_submission_20260524/"
        ],
        "external_gate": null
      },
      "artifact_policy": "source",
      "formula_logic": "adapter-only",
      "claim_boundary": "Julia General publication is verified; runtime support remains limited to the thin adapter and fixture-parity scope."
    },
    {
      "id": "go-binding",
      "display_name": "Go binding module",
      "category": "binding",
      "lifecycle": "implemented",
      "support_status": "preview",
      "path": "bindings/go",
      "manifests": [
        "bindings/go/go.mod"
      ],
      "owner_track": "go_binding_20260512",
      "ci_gate": "tests/test_go_binding_track.py",
      "release": {
        "target": "Go module proxy and pkg.go.dev",
        "workflow": "tagged module release",
        "version_source": "bindings/go/go.mod",
        "registry_state": "published_verified",
        "evidence": [
          "conductor/tracks/go_module_registry_submission_20260524/"
        ],
        "external_gate": null
      },
      "artifact_policy": "source",
      "formula_logic": "adapter-only",
      "claim_boundary": "Go module exposes binding contracts and must not duplicate formulas."
    },
    {
      "id": "dotnet-binding",
      "display_name": ".NET binding package",
      "category": "binding",
      "lifecycle": "implemented",
      "support_status": "preview",
      "path": "bindings/dotnet",
      "manifests": [
        "bindings/dotnet/DotNetBinding.csproj"
      ],
      "owner_track": "csharp_dotnet_binding_20260512",
      "ci_gate": "tests/test_csharp_dotnet_binding_track.py",
      "release": {
        "target": "NuGet",
        "workflow": "manual or release workflow package publication",
        "version_source": "bindings/dotnet/DotNetBinding.csproj",
        "registry_state": "published_verified",
        "evidence": [
          "conductor/tracks/dotnet_nuget_registry_submission_20260524/"
        ],
        "external_gate": null
      },
      "artifact_policy": "source",
      "formula_logic": "adapter-only",
      "claim_boundary": ".NET package is a file/service adapter surface over shared contracts."
    },
    {
      "id": "swift-binding",
      "display_name": "Swift Package",
      "category": "binding",
      "lifecycle": "implemented",
      "support_status": "preview",
      "path": "bindings/swift",
      "manifests": [
        "bindings/swift/Package.swift"
      ],
      "owner_track": "swift_binding_20260513",
      "ci_gate": "tests/test_swift_binding_track.py",
      "release": {
        "target": "Swift Package Index",
        "workflow": "PackageList issue and public SPI indexing",
        "version_source": "bindings/swift/Package.swift",
        "registry_state": "published_verified",
        "evidence": [
          "conductor/archive/swift_package_index_submission_20260524/"
        ],
        "external_gate": null
      },
      "artifact_policy": "source",
      "formula_logic": "adapter-only",
      "claim_boundary": "Swift Package Index publication is verified; compatibility build results remain external processing evidence and do not expand runtime support."
    },
    {
      "id": "jvm-binding",
      "display_name": "JVM binding package",
      "category": "binding",
      "lifecycle": "implemented",
      "support_status": "preview",
      "path": "bindings/jvm",
      "manifests": [
        "bindings/jvm/build.gradle.kts",
        "bindings/jvm/settings.gradle.kts"
      ],
      "owner_track": "jvm_maven_central_registry_submission_20260524",
      "ci_gate": "tests/test_jvm_maven_central_registry_submission_track.py",
      "release": {
        "target": "Maven Central",
        "workflow": "Central Portal publication",
        "version_source": "bindings/jvm/build.gradle.kts",
        "registry_state": "published_verified",
        "evidence": [
          "conductor/archive/jvm_maven_central_registry_submission_20260524/"
        ],
        "external_gate": null
      },
      "artifact_policy": "source",
      "formula_logic": "adapter-only",
      "claim_boundary": "Maven Central publication is verified; JVM support remains limited to the binding contract and package evidence scope."
    },
    {
      "id": "scala-spark-binding",
      "display_name": "Scala and Spark binding",
      "category": "binding",
      "lifecycle": "implemented",
      "support_status": "preview",
      "path": "bindings/scala-spark",
      "manifests": [
        "bindings/scala-spark/build.sbt"
      ],
      "owner_track": "scala_spark_binding_20260513",
      "ci_gate": "tests/test_scala_spark_binding_track.py",
      "release": {
        "target": "internal package or Maven-style publication",
        "workflow": "repository-local validation",
        "version_source": "bindings/scala-spark/build.sbt",